{
  "asset_conflicts": 0,
  "completion_status": "completed",
  "coordination_seconds": 86,
  "dependency_conflicts": 0,
  "duplicate_or_abandoned_work": 0,
  "fanout_elected": true,
  "fanout_reason": "Arm B fan-out was elected for independent simulation, browser-journey, and asset/API review packages. Final: build PASS; unit tests PASS 8/8; E2E PASS 1/1 in 36.0s; Playwright CLI at 1280x720 confirmed UI and 0 console errors. Blocking events: npm install 30s for missing dependencies, two early E2E fixes, and Chrome CLI fallback to Chromium. Human intervention: 0. Protected task/assets/protocol files unchanged.",
  "interface_conflicts": 0,
  "provider_wait_seconds": 0,
  "rescue_events": 0,
  "semantic_conflicts": 0,
  "skill_context_tokens": 0,
  "skill_loads": 10,
  "worker_count": 3
}
